{
  "schema_name": "dataset-manifest",
  "schema_version": "0.1.0",
  "dataset_id": "dataset_0195395c-7c9e-7389-bda4-6a8b0c2d4e56",
  "input_manifests": [
    {
      "manifest_id": "rawmanifest_0195395c-7c9e-7056-8a71-3d5e7f9a1b23",
      "run_id": "run_0195395c-7c9e-7f56-9b70-2c4d6e8f0a12",
      "content_digest": "bbbbbbbbbbbbbbbbbbbbbbbbbbbbbbbbbbbbbbbbbbbbbbbbbbbbbbbbbbbbbbbb"
    }
  ],
  "input_datasets": [],
  "transformation_id": "transformation_0195395c-7c9e-7278-ac93-5f7a9b1c3d45",
  "transformation_version": "normalize-1",
  "transformation_parameters": {
    "schema_ref": "urn:ea-research-lab:schema:example-transformation-parameters:0.1.0",
    "value": {
      "mode": "opaque"
    }
  },
  "created_at": "2026-08-09T12:05:00Z",
  "dataset_schema": "urn:ea-research-lab:schema:example-dataset-content:0.1.0"
}
